category_super_group_ID,category_super_group,category_group_ID,saveframe_category,category_group,mandatory_code,BMRB mandatory,mandatory_number,ADIT replicable,allowed_user_defined_framecode,specified_framecode,tag category requirements,validateFlgs,,,,,,viewFlags,,,,,,NMR-STAR ordinal,rdbms_name,category_group_view_name,group_view_help,mandatory_code,BMRB mandatory,mandatory_number,ADIT replicable,allowed_user_defined_framecode,viewFlags,category_group_view_name,group_view_help,mandatory_code,BMRB mandatory,mandatory_number,ADIT replicable,allowed_user_defined_framecode,viewFlags,category_group_view_name,group_view_help,-------------------------------,----------------,--------------,------------------------------,-----------,S=SG mandatory; M=mandatory; H=hidden; MC=mandatory conditional; O=optional,---------, -----------,---------,-------,,BMRB biopolymer public release,BMRB small molecule structure public release,biopolymer internal valid meta data,small molecule structure internal valid meta data,BMRB metabolomics public release,metabolomics internal valid meta data,public,internal,meta,sg/public,sg/internal,usr/public,-----------,-----------,-----------, ------------,-----------,S=SG mandatory; M=mandatory; H=hidden; MC=mandatory conditional; O=optional,---------, -----------,---------,public, ------------, ------------,-----------,S=SG mandatory; M=mandatory; H=hidden; MC=mandatory conditional; O=optional,---------, -----------,---------,public, ------------, ------------TBL_BEGIN,,,,,,,,,,,,validate,public,,internal,public,internal,viewFlags,,,,,,,,,,,,,,,viewFlags,,?,,,,,,viewFlags,,?1,entry_information,9,deposited_data_files,deposited_data_files,H,H,1,N,N,deposited_data_files,,I,I,M,O,I,O,H,H,H,H,H,H,?,,Deposit data files,To upload data files from your system to BMRB$ in the fields provided$ select a data file from your local directory system$ and define the kind of data in the file. If the file contains more than one kind of data$ please indicate in the entry interview each kind of data that you are depositing.,H,H,1,N,N,H,Deposit data files,To upload data files from your system to BMRB$ in the fields provided$ select a data file from your local directory system$ and define the kind of data in the file. If the file contains more than one kind of data$ please indicate in the entry interview each kind of data that you are depositing.,H,H,1,N,N,H,Deposit data files,To upload data files from your system to BMRB$ in the fields provided$ select a data file from your local directory system$ and define the kind of data in the file. If the file contains more than one kind of data$ please indicate in the entry interview each kind of data that you are depositing.1,entry_information,8,entry_interview,entry_interview,Y,M,1,N,N,entry_interview,,I,I,M,O,I,O,N,H,H,H,H,H,?,,Entry interview,Select the type of deposition you would like to start (BMRB only or PDB/BMRB). The information entered as you complete the deposition will apply to both a BMRB only and a PDB/BMRB deposition. At any time$ you can switch between a BMRB only and a PDB/BMRB deposition using the 'View mode' buttons in the upper left hand corner of the interface. Additional information describing the deposition process can be obtained by clicking on the 'Help' button at the top of the page.,Y,M,1,N,N,N,Entry interview,Select the kind(s) of data you plan to deposit. At anytime during the deposition process$ you can return to the entry interview page and change your selections. Additional information describing the deposition process can be obtained by clicking on the 'Help' button at the top of the page.,Y,M,1,N,N,N,Entry interview,Atomic coordinates$ restraints$ and assigned chemical shifts are required. Select other kind(s) of data you plan to deposit. At anytime during the deposition process$ you can return to the entry interview page and change your selections. Additional information describing the deposition process can be obtained by clicking on the 'Help' button at the top of the page.1,entry_information,10,study_list,study_list,Y,M,,N,Y,,,O,O,O,O,O,O,N,H,H,H,H,H,?,,Studies,A study is made up of one or more entries.  You may define a name and type of study conducted and provide the entry(s) that compose the study.  If a study is not defined$ it will be assumed that the entry is the only member of a study and information provided for the entry will be used to poplulate corresponding tags in the study section to produce the final entry.,H,O,,N,Y,H,Studies,A study is made up of one or more entries.  You may define a name and type of study conducted and provide the entry(s) that compose the study.  If a study is not defined$ it will be assumed that the entry is the only member of a study and information provided for the entry will be used to poplulate corresponding tags in the study section to produce the final entry.,H,O,,N,Y,H,Studies,A study is made up of one or more entries.  You may define a name and type of study conducted and provide the entry(s) that compose the study.  If a study is not defined$ it will be assumed that the entry is the only member of a study and information provided for the entry will be used to poplulate corresponding tags in the study section to produce the final entry.1,entry_information,20,entry_information,entry_information,Y,M,1,N,N,entry_information,Data_set and Entry_author and Release,M,M,M,M,M,M,N,H,H,H,H,H,?,,Entry information,Provide information that describes the entry and the people responsible for the deposition. For the contact people$ please enter the e-mail address first. If the person is a prior depositor at the BMRB$ many of the additional fields for the contact person may be filled in automatically.,Y,M,1,N,N,N,Entry information,Provide information that describes the entry.,Y,M,1,N,N,N,Entry information,Provide information that describes the entry.2,citations,40,citations,citations,Y,M,1,Y,Y,,Citation_author,M,M,M,M,M,M,N,H,H,H,H,H,?,,Citations,The title$ authors$ and reference information for a citation are entered in this section. ,Y,M,1,Y,Y,N,Citations,The title$ authors$ and reference information for a citation are entered in this section. ,Y,M,1,Y,Y,N,Citations,The title$ authors$ and reference information for a citation are entered in this section. 3,assembly_supercategory,50,chem_comp,chem_comp,N,MC,,Y,Y,,,O,O,O,O,M,M,H,H,H,H,H,H,?,,Ligands$ cofactors$ etc.,Enter a description for each chemically unique ligand molecule or non-standard biopolymer residue (chemical component) in the molecular system. If the chemical component exists in the PDB Ligand Depot$ simply enter the PDB chemical component ID for the compound in the appropriate field and click on the 'Save Changes' button. More help can be found <a href='http://www.bmrb.wisc.edu/deposit/mol_assembly' TARGET='_blank'> here </a>.,Y,M,,Y,Y,H,Chemical compound,Enter a description for the metabolite or chemical compound that has been studied. If the chemical compound exists in the PDB Ligand Depot$ simply enter the PDB chemical component ID for the compound in the appropriate field and click on the 'Save Changes' button. More help can be found <a href='http://www.bmrb.wisc.edu/deposit/mol_assembly' TARGET='_blank'> here </a>.,Y,M,,Y,Y,H,Chemical compound,Enter a description for the metabolite or chemical compound that has been studied. If the chemical compound exists in the PDB Ligand Depot$ simply enter the PDB chemical component ID for the compound in the appropriate field and click on the 'Save Changes' button. More help can be found <a href='http://www.bmrb.wisc.edu/deposit/mol_assembly' TARGET='_blank'> here </a>.3,assembly_supercategory,60,entity,entity,Y,M,1,Y,Y,,Entity_comp_index,M,M,M,M,M,M,N,H,H,H,H,H,?,,Molecular entity,A molecular entity is a chemically unique molecule (polymer or nonpolymer) in the system studied. For a homodimer$ a description of one monomer is required.  For a heterodimer (non palindromic DNA$ protein-protein complex$ DNA-RNA complex) or a biopolymer ligand complex$ both molecules need to be described by completing two molecular entity forms. For more complex molecular systems$ additional molecular entity forms may need to be filled out. Nonpolymers (ligands$ metal ions$ etc.) are described briefly here and more completely in the section for ligands. More help can be found <a href='http://www.bmrb.wisc.edu/deposit/mol_assembly' TARGET='_blank'> here </a>.,H,O,,Y,Y,H,Molecular entity,A molecular entity is a chemically unique molecule (polymer or nonpolymer) in the system studied. For a homodimer$ a description of one monomer is required.  For a heterodimer (non palindromic DNA$ protein-protein complex$ DNA-RNA complex) or a biopolymer ligand complex$ both molecules need to be described by completing two molecular entity forms. For more complex molecular systems$ additional molecular entity forms may need to be filled out. Nonpolymers (ligands$ metal ions$ etc.) are described briefly here and more completely in the section for ligands. More help can be found <a href='http://www.bmrb.wisc.edu/deposit/mol_assembly' TARGET='_blank'> here </a>.,H,O,,Y,Y,H,Molecular entity,A molecular entity is a chemically unique molecule (polymer or nonpolymer) in the system studied. For a homodimer$ a description of one monomer is required.  For a heterodimer (non palindromic DNA$ protein-protein complex$ DNA-RNA complex) or a biopolymer ligand complex$ both molecules need to be described by completing two molecular entity forms. For more complex molecular systems$ additional molecular entity forms may need to be filled out. Nonpolymers (ligands$ metal ions$ etc.) are described briefly here and more completely in the section for ligands. More help can be found <a href='http://www.bmrb.wisc.edu/deposit/mol_assembly' TARGET='_blank'> here </a>.3,assembly_supercategory,70,assembly,assembly,Y,M,1,Y,Y,,Entity_assembly,M,M,M,M,I,I,N,H,H,H,H,H,?,,Molecular assembly,The molecular assembly is the set of all molecules that make up the system studied. Simple examples include a single polypeptide chain$ a homodimer consisting of two components$ a duplex DNA system that has two components$ or protein ligand complex that has two components. A more detailed description for molecular assembly is found <a href='http://www.bmrb.wisc.edu/deposit/mol_assembly' TARGET='_blank'> here </a>.,H,O,,N,Y,H,Molecular assembly,The molecular assembly is the set of all molecules that make up the system studied. Simple examples include a single polypeptide chain$ a homodimer consisting of two components$ a duplex DNA system that has two components$ or protein ligand complex that has two components. A more detailed description for molecular assembly is found <a href='http://www.bmrb.wisc.edu/deposit/mol_assembly' TARGET='_blank'> here </a>.,H,O,,N,Y,H,Molecular assembly,The molecular assembly is the set of all molecules that make up the system studied. Simple examples include a single polypeptide chain$ a homodimer consisting of two components$ a duplex DNA system that has two components$ or protein ligand complex that has two components. A more detailed description for molecular assembly is found <a href='http://www.bmrb.wisc.edu/deposit/mol_assembly' TARGET='_blank'> here </a>.3,assembly_supercategory,80,assembly_annotation,assembly_annotation,H,O,,Y,Y,,,O,O,O,O,I,I,H,H,H,H,H,H,?,,Molecular assembly annotation,Authors may use this section to provide unique annotation for the molecular assembly studied.,H,O,,N,Y,H,Molecular assembly annotation,Authors may use this section to provide unique annotation for the molecular assembly studied.,H,O,,N,Y,H,Molecular assembly annotation,Authors may use this section to provide unique annotation for the molecular assembly studied.3,assembly_supercategory,90,assembly_subsystems,assembly_subsystems,H,O,,Y,Y,,,O,O,O,O,I,I,H,H,H,H,H,H,?,,Molecular assembly subsystem descriptions,Subsystems of the complete molecular assembly may be defined using this section.,H,O,,Y,Y,H,Molecular assembly subsystem descriptions,Subsystems of the complete molecular assembly may be defined using this section.,H,O,,Y,Y,H,Molecular assembly subsystem descriptions,Subsystems of the complete molecular assembly may be defined using this section.3,assembly_supercategory,100,natural_source,natural_source,Y,M,1,N,N,natural_source,Entity_natural_src,M,M,M,M,I,I,N,H,H,H,H,H,?,,Natural source,Provide the natural source for all biopolymers in the molecular assembly that was studied.  The natural source for organic and inorganic ligands is not required.,H,O, ,N,N,H,Natural source,Provide the natural source for all biopolymers in the molecular assembly that was studied.  The natural source for organic and inorganic ligands is not required.,H,O, ,N,N,H,Natural source,Provide the natural source for all biopolymers in the molecular assembly that was studied.  The natural source for organic and inorganic ligands is not required.3,assembly_supercategory,110,experimental_source,experimental_source,Y,M,1,N,N,experimental_source,Entity_experimental_src,M,M,M,M,I,I,N,H,H,H,H,H,?,,Experimental source,Enter the source used to produce the biopolymers studied in this entry.  In most cases$ this would be the host organism and plasmid used to overproduce a protein. If the biopolymer was chemically synthesized or purchased from a vendor$ please make the appropriate selection in the production method field and then click on 'Save changes'. This will modify the number and types of data fields that appear in the interface.,H,O, ,N,N,H,Experimental source,Enter the source used to produce the biopolymers studied in this entry.  In most cases$ this would be the host organism and plasmid used to over produce a protein. If the biopolymer was chemically synthesized or purchased from a vendor$ please make the appropriate selection in the production method field and then click on 'Save changes'. This will modify the number and types of data fields that appear in the interface.,H,O, ,N,N,H,Experimental source,Enter the source used to produce the biopolymers studied in this entry.  In most cases$ this would be the host organism and plasmid used to over produce a protein. If the biopolymer was chemically synthesized or purchased from a vendor$ please make the appropriate selection in the production method field and then click on 'Save changes'. This will modify the number and types of data fields that appear in the interface.4,experimental_details,130,sample,sample,Y,M,,Y,Y,,Sample_component,M,M,M,M,M,M,N,H,H,H,H,H,?,,Sample,Enter the complete contents for each sample used in the study.  This includes the molecules in the study (biopolymers and ligands)$ buffers$ salts$ and additives such as DTT$ etc.,Y,M,,Y,Y,N,Sample,Enter the complete contents for each sample used in the study.  This includes the molecules in the study (biopolymers and ligands)$ buffers$ salts$ and additives such as DTT$ etc.,Y,M,,Y,Y,N,Sample,Enter the complete contents for each sample used in the study.  This includes the molecules in the study (biopolymers and ligands)$ buffers$ salts$ and additives such as DTT$ etc.4,experimental_details,140,sample_conditions,sample_conditions,Y,M,,Y,Y,,Sample_condition_variable,M,M,M,M,M,M,N,H,H,H,H,H,?,,Sample conditions,Provide at least the pH and temperature for each set of conditions used to collect the data listed in the entry.,Y,M,,Y,Y,N,Sample conditions,Provide at least the pH and temperature for each set of conditions used to collect the data listed in the entry.,Y,M,,Y,Y,N,Sample conditions,Provide at least the pH and temperature for each set of conditions used to collect the data listed in the entry.4,experimental_details,141,molecule_purity,molecule_purity,N,S,,Y,N,sample_mol_purity,,O,O,O,O,O,O,H,H,H,H,H,H,?,,Sample content purity,Enter the measured purity of each unique biopolymer in the samples used and define the method used to measure purity.,N,S,,Y,N,H,Sample content purity,Enter the measured purity of each unique biopolymer in the samples used and define the method used to measure purity.,N,S,,Y,N,H,Sample content purity,Enter the measured purity of each unique biopolymer in the samples used and define the method used to measure purity.4,experimental_details,142,software,software,N,S,,Y,Y,,,O,O,O,O,O,O,N,H,H,H,H,H,?,,Software descriptions,Provide information for each software application used (name$ version$ vendor$ etc.).,N,S,,Y,Y,N,Software descriptions,Provide information for each software application used (name$ version$ vendor$ etc.).,N,S,,Y,Y,N,Software descriptions,Provide information for each software application used (name$ version$ vendor$ etc.).4,experimental_details,143,method,method,N,S,,Y,Y,,,O,O,O,O,O,O,H,H,H,H,H,H,?,,Methods,Please enter details about the methods used at any stage in the generation of the data provided in this entry.  The reported methods can be linked to many sections of the depositon including sample preparation$ NMR experiments and data processing$ and data analysis.,N,O,,Y,Y,H,Methods,Please enter details about the methods used at any stage in the generation of the data provided in this entry.  The reported methods can be linked to many sections of the depositon including sample preparation$ NMR experiments and data processing$ and data analysis.,N,O,,Y,Y,H,Methods,Please enter details about the methods used at any stage in the generation of the data provided in this entry.  The reported methods can be linked to many sections of the depositon including sample preparation$ NMR experiments and data processing$ and data analysis.4,experimental_details,144,Mass_spectrometer,Mass_spectrometer,N,O,,Y,Y,,,O,O,O,O,O,O,H,H,H,H,H,H,?,,Mass spectrometer,Enter details describing the mass spectrometers used.,N,O,,Y,Y,H,Mass spectrometer,help text,N,O,,Y,Y,H,Mass spectrometer,help text4,experimental_details,145,Mass_spectrometer_list,Mass_spectrometer_list,N,O,,N,N,Mass_spectrometer_list,,O,O,O,O,O,O,H,H,H,H,H,H,?,,Mass spectrometer list,Provide a list of the Mass spectrometers used.,N,O,,N,N,H,Mass spectrometer list,help text,N,O,,N,N,H,Mass spectrometer list,help text4,experimental_details,146,Mass_spec_ref_compd,Mass_spec_ref_compd,N,O,,Y,Y,,,O,O,O,O,O,O,H,H,H,H,H,H,?,,Mass spectral reference compounds,List information describing the chemical compounds used as references in carrying out the mass analysis.,N,O,,Y,Y,H,Mass spectral reference compounds,help text,N,O,,Y,Y,H,Mass spectral reference compounds,help text4,experimental_details,147,chromatographic_system,chromatographic_system,N,O,,Y,Y,,,O,O,O,O,O,O,H,H,H,H,H,H,?,,Chromatographic system,Enter a description of the chromatographic system(s) used.,N,O,,Y,Y,H,Chromatographic system,help text,N,O,,Y,Y,H,Chromatographic system,help text4,experimental_details,148,chromatographic_column,chromatographic_column,N,O,,Y,Y,,,O,O,O,O,O,O,H,H,H,H,H,H,?,,Chromatographic column,help text,N,O,,Y,Y,H,Chromatographic column,help text,N,O,,Y,Y,H,Chromatographic column,help text4,experimental_details,149,fluorescence_instrument,fluorescence_instrument,N,O,,Y,Y,,,O,O,O,O,O,O,H,H,H,H,H,H,?,,Fluorescence instrument,help text,N,O,,Y,Y,H,Fluorescence instrument,help text,N,O,,Y,Y,H,Fluorescence instrument,help text4,experimental_details,150,EMR_instrument,EMR_instrument,N,O,,Y,Y,,,O,O,O,O,O,O,H,H,H,H,H,H,?,,EMR instrument,help text,N,O,,Y,Y,H,EMR instrument,help text,N,O,,Y,Y,H,EMR instrument,help text4,experimental_details,151,Xray_instrument,Xray_instrument,N,O,,Y,Y,,,O,O,O,O,O,O,H,H,H,H,H,H,?,,Xray instrument,help text,N,O,,Y,Y,H,Xray instrument,help text,N,O,,Y,Y,H,Xray instrument,help text4,experimental_details,155,NMR_spectrometer,NMR_spectrometer,N,S,,Y,Y,,,O,O,O,O,O,O,H,H,H,H,H,H,?,,NMR spectrometer,Provide details describing the NMR spectrometer(s) used.,N,S,,Y,Y,H,NMR spectrometer,help text,N,S,,Y,Y,H,NMR spectrometer,help text4,experimental_details,156,NMR_spectrometer_list,NMR_spectrometer_list,N,S,,N,N,NMR_spectrometer_list,,O,O,O,O,O,O,N,H,H,H,H,H,?,,NMR spectrometer list,Provide a list of the NMR spectrometers used.,N,M,,N,N,N,NMR spectrometer list,Provide a list of the NMR spectrometers used.,N,M,,N,N,N,NMR spectrometer list,Provide a list of the NMR spectrometers used.4,experimental_details,157,NMR_spectrometer_probe,NMR_spectrometer_probe,N,S,,Y,Y,,,O,O,O,O,O,O,H,H,H,H,H,H,?,,NMR probe descriptions,NMR spectrometer probes are listed and described in this section.,N,S,,Y,Y,H,NMR probe descriptions,NMR spectrometer probes are listed and described in this section.,N,S,,Y,Y,H,NMR probe descriptions,NMR spectrometer probes are listed and described in this section.4,experimental_details,158,experiment_list,experiment_list,N,MC,,N,N,experiment_list,Experiment,M,M,O,M,M,M,N,H,H,H,H,H,?,,NMR experiments and samples,Please provide a list of the NMR experiments carried out and indicate the sample and sample conditions used for each experiment. If the same NMR experiment was carried out with two or more different samples or two or more different sample conditions$ enter a new row in the table below for each combination of NMR experiment$ sample$ and sample condition used.,N,M,,N,N,N,NMR experiments and samples,Please provide a list of the NMR experiments carried out and indicate the sample and sample conditions used for each experiment. If the same NMR experiment was carried out with two or more different samples or two or more different sample conditions$ enter a new row in the table below for each combination of NMR experiment$ sample$ and sample condition used.,N,M,,N,N,N,NMR experiments and samples,Please provide a list of the NMR experiments carried out and indicate the sample and sample conditions used for each experiment. If the same NMR experiment was carried out with two or more different samples or two or more different sample conditions$ enter a new row in the table below for each combination of NMR experiment$ sample$ and sample condition used.4,experimental_details,159,NMR_spectrometer_expt,NMR_spectrometer_expt,N,S,,Y,Y,,,O,O,O,M,O,O,N,H,H,H,H,H,?,,NMR experiment details,Enter specific details regarding each NMR experiment here.,N,O,,Y,Y,N,NMR experiment details,Enter specific details regarding each NMR experiment here.,N,O,,Y,Y,N,NMR experiment details,Enter specific details regarding each NMR experiment here.4,experimental_details,160,NMR_spectral_processing,NMR_spectral_processing,N,S,,Y,Y,,,O,O,O,O,O,O,H,H,H,H,H,H,?,,NMR spectral processing protocols,Enter specific details about the protocols used to process the raw NMR spectral data sets.,N,O,,Y,Y,H,NMR spectral processing protocols,Enter specific details about the protocols used to process the raw NMR spectral data sets.,N,O,,Y,Y,H,NMR spectral processing protocols,Enter specific details about the protocols used to process the raw NMR spectral data sets.4,experimental_details,161,MS_expt,MS_expt,N,O,,Y,Y,,,O,O,O,O,O,O,H,H,H,H,H,H,?,,Mass spect experiment details,help text,N,O,,Y,Y,H,Mass spect experiment details,help text,N,O,,Y,Y,H,Mass spect experiment details,help text4,experimental_details,162,FRET_expt,FRET_expt,N,O,,Y,Y,,,O,O,O,O,O,O,H,H,H,H,H,H,?,,Fluorescence experiment details,help text,N,O,,Y,Y,H,Fluorescence experiment details,help text,N,O,,Y,Y,H,Fluorescence experiment details,help text4,experimental_details,163,EMR_expt,EMR_expt,N,O,,Y,Y,,,O,O,O,O,O,O,H,H,H,H,H,H,?,,Electron magnetic resonance experiment details,help text,N,O,,Y,Y,H,Electron magnetic resonance experiment details,help text,N,O,,Y,Y,H,Electron magnetic resonance experiment details,help text4,experimental_details,164,SAXS_expt,SAXS_expt,N,O,,Y,Y,,,O,O,O,O,O,O,H,H,H,H,H,H,?,,Small-angle X-ray scattering experiment details,help text,N,O,,Y,Y,H,Small-angle X-ray scattering experiment details,help text,N,O,,Y,Y,H,Small-angle X-ray scattering experiment details,help text4,experimental_details,167,computer,computer,N,O,,Y,Y,,,O,O,O,O,O,O,H,H,H,H,H,H,?,,Computer hardware description,Enter details regarding the computer hardware used to collect$ process$ and analyze the data reported.,N,O,,Y,Y,H,Computer hardware description,Enter details regarding the computer hardware used to collect$ process$ and analyze the data reported.,N,O,,Y,Y,H,Computer hardware description,Enter details regarding the computer hardware used to collect$ process$ and analyze the data reported.5,NMR_parameters,168,chem_shift_reference,chem_shift_reference,N,MC,,Y,Y,,Chem_shift_ref,O,O,O,O,O,O,H,H,H,H,H,H,?,,Chemical shift references,<B>Accurate chemical shift referencing is critical. Indicate below the nuclei reported (1H$ 13C$ 15N$ etc.) and If the IUPAC recommend chemical shift referencing method was used and then save the page. If other referencing compounds or methods were used$ enter the information in the table provided.</B> ,N,MC,,Y,Y,H,Chemical shift references,<B>Accurate chemical shift referencing is critical. Indicate below the nuclei reported (1H$ 13C$ 15N$ etc.) and If the IUPAC recommend chemical shift referencing method was used and then save the page. If other referencing compounds or methods were used$ enter the information in the table provided.</B> ,N,MC,,Y,Y,H,Chemical shift references,<B>Accurate chemical shift referencing is critical. Indicate below the nuclei reported (1H$ 13C$ 15N$ etc.) and If the IUPAC recommend chemical shift referencing method was used and then save the page. If other referencing compounds or methods were used$ enter the information in the table provided.</B> 