category_super_group_ID,category_super_group,category_group_ID,saveframe_category,category_group,mandatory_code,BMRB mandatory,mandatory_number,ADIT replicable,allowed_user_defined_framecode,specified_framecode,tag category requirements,validateFlgs,,,,,,viewFlags,,,,,,NMR-STAR ordinal,rdbms_name,category_group_view_name,group_view_help,mandatory_code,BMRB mandatory,mandatory_number,ADIT replicable,allowed_user_defined_framecode,viewFlags,category_group_view_name,group_view_help,mandatory_code,BMRB mandatory,mandatory_number,ADIT replicable,allowed_user_defined_framecode,viewFlags,category_group_view_name,group_view_help5,NMR_parameters,170,assigned_chemical_shifts,assigned_chemical_shifts,N,MC,,Y,Y,,Atom_chem_shift,O,O,O,O,O,O,H,H,H,H,H,H,?,,Assigned chemical shifts,Please supply the file name$ samples$ conditions$ and NMR experiments used to collect the data in the uploaded assigned chemical shift data file.,N,MC,,Y,Y,H,Assigned chemical shifts,Please supply the file name$ samples$ conditions$ and NMR experiments used to collect the data in the uploaded assigned chemical shift data file.,N,MC,,Y,Y,H,Assigned chemical shifts,Please supply the file name$ samples$ conditions$ and NMR experiments used to collect the data in the uploaded assigned chemical shift data file.5,NMR_parameters,172,coupling_constants,coupling_constants,N,MC,,Y,Y,,Coupling_constant,O,O,O,O,O,O,H,H,H,H,H,H,?,,Coupling constants,For each set of scalar coupling constants deposited$ provide the experimental details (the uploaded file name$ samples$ conditions$ and NMR experiments$ etc.).,N,MC,,Y,Y,H,Coupling constants,For each set of scalar coupling constants deposited$ provide the experimental details (the uploaded file name$ samples$ conditions$ and NMR experiments$ etc.).,N,MC,,Y,Y,H,Coupling constants,For each set of scalar coupling constants deposited$ provide the experimental details (the uploaded file name$ samples$ conditions$ and NMR experiments$ etc.).5,NMR_parameters,173,theoretical_coupling_constants,theoretical_coupling_constants,N,MC,,Y,Y,,Theoretical_coupling_constant,O,O,O,O,O,O,H,H,H,H,H,H,?,,Theoretical coupling constants,Theoretical coupling constant values are derived either by empirical methods$ ab initio calculations$ or a combination of the two approaches. Please enter a label for the reported values$ the file name for the data$ the method used to calculate the coupling constants$ the atomic coordinates used.,N,MC,,Y,Y,H,Theoretical coupling constants,Theoretical coupling constant values are derived either by empirical methods$ ab initio calculations$ or a combination of the two approaches. Please enter a label for the reported values$ the file name for the data$ the method used to calculate the coupling constants$ the atomic coordinates used.,N,MC,,Y,Y,H,Theoretical coupling constants,Theoretical coupling constant values are derived either by empirical methods$ ab initio calculations$ or a combination of the two approaches. Please enter a label for the reported values$ the file name for the data$ the method used to calculate the coupling constants$ the atomic coordinates used.5,NMR_parameters,174,spectral_peak_list,spectral_peak_list,N,MC,,Y,Y,,Peak or Spectral_transition,O,O,O,O,O,O,H,H,H,H,H,H,?,,Spectral peak lists,Information linking the uploaded peak list files to the source NMR experiment and other details is entered in this form.,N,MC,,Y,Y,H,Spectral peak lists,Information linking the uploaded peak list files to the source NMR experiment and other details is entered in this form.,N,MC,,Y,Y,H,Spectral peak lists,Information linking the uploaded peak list files to the source NMR experiment and other details is entered in this form.5,NMR_parameters,178,resonance_linker,resonance_linker,N,MC,,Y,Y,,Resonance_assignment,O,O,O,O,O,O,H,H,H,H,H,H,?,,Data derivation,help text,N,MC,,Y,Y,H,Data derivation,help text,N,MC,,Y,Y,H,Data derivation,help text5,NMR_parameters,190,chem_shift_isotope_effect,chem_shift_isotope_effect,N,MC,,Y,Y,,Isotope_effect,O,O,O,O,O,O,H,H,H,H,H,H,?,,Chemical shift isotope effects,The details describing experiments measuring the effects of isotopic nuclear substitutions on the chemical shfits of neighboring nuclei are entered in this section.,N,MC,,Y,Y,H,Chemical shift isotope effects,The details describing experiments measuring the effects of isotopic nuclear substitutions on the chemical shfits of neighboring nuclei are entered in this section.,N,MC,,Y,Y,H,Chemical shift isotope effects,The details describing experiments measuring the effects of isotopic nuclear substitutions on the chemical shfits of neighboring nuclei are entered in this section.5,NMR_parameters,200,chem_shift_interaction_diff,chem_shift_interaction_diff,N,MC,,Y,Y,,Mol_interaction_chem_shift,O,O,O,O,O,O,H,H,H,H,H,H,?,,Molecular interaction data,The results of molecular interaction studies that involve the effects on the chemical shifts of atoms in one or both of the interacting molecules are described in this section.,N,MC,,Y,Y,H,Molecular interaction data,The results of molecular interaction studies that involve the effects on the chemical shifts of atoms in one or both of the interacting molecules are described in this section.,N,MC,,Y,Y,H,Molecular interaction data,The results of molecular interaction studies that involve the effects on the chemical shifts of atoms in one or both of the interacting molecules are described in this section.5,NMR_parameters,210,chem_shift_anisotropy,chem_shift_anisotropy,N,MC,,Y,Y,,CS_anisotropy,O,O,O,O,O,O,H,H,H,H,H,H,?,,Chemical shift anisotropy,Please enter the name of the uploaded file containing the chemical shift anisotropy data and the samples and sample conditions used to collect the data.,N,MC,,Y,Y,H,Chemical shift anisotropy,Please enter the name of the uploaded file containing the chemical shift anisotropy data and the samples and sample conditions used to collect the data.,N,MC,,Y,Y,H,Chemical shift anisotropy,Please enter the name of the uploaded file containing the chemical shift anisotropy data and the samples and sample conditions used to collect the data.5,NMR_parameters,220,theoretical_chem_shifts,theoretical_chem_shifts,N,MC,,Y,Y,,Theoretical_chem_shift,O,O,O,O,O,O,H,H,H,H,H,H,?,,Theoretical chemical shifts,Theoretical chemical shift values are derived either by empirical methods$ ab initio calculations$ or a combination of the two approaches. Please enter a label for the reported values$ the file name for the data$ the method used to calculate the chemical shifts$ the atomic coordinates used$ the label for the chemical shielding tensors$ if calculated$ and for paramagnetic systems$ fermi contact spin density units.,N,MC,,Y,Y,H,Theoretical chemical shifts,Theoretical chemical shift values are derived either by empirical methods$ ab initio calculations$ or a combination of the two approaches. Please enter a label for the reported values$ the file name for the data$ the method used to calculate the chemical shifts$ the atomic coordinates used$ the label for the chemical shielding tensors$ if calculated$ and for paramagnetic systems$ fermi contact spin density units.,N,MC,,Y,Y,H,Theoretical chemical shifts,Theoretical chemical shift values are derived either by empirical methods$ ab initio calculations$ or a combination of the two approaches. Please enter a label for the reported values$ the file name for the data$ the method used to calculate the chemical shifts$ the atomic coordinates used$ the label for the chemical shielding tensors$ if calculated$ and for paramagnetic systems$ fermi contact spin density units.5,NMR_parameters,230,chem_shifts_calc_type,chem_shifts_calc_type,N,MC,,Y,Y,,,O,O,O,O,O,O,H,H,H,H,H,H,?,,Chemical shift calculation type,Please supply the details requested regarding the type of calculation method used to determine the theoretical chemical shifts.,N,MC,,Y,Y,H,Chemical shift calculation type,Please supply the details requested regarding the type of calculation method used to determine the theoretical chemical shifts.,N,MC,,Y,Y,H,Chemical shift calculation type,Please supply the details requested regarding the type of calculation method used to determine the theoretical chemical shifts.5,NMR_parameters,270,RDCs,RDCs,N,MC,,Y,Y,,RDC,O,O,O,O,O,O,H,H,H,H,H,H,?,,Residual dipolar couplings,Details regarding the experiments used to collect residual dipolar coupling data are reported below. This includes the spectrometer frequency$ and the isotropic and anisotropic sample and sample conditions.,N,MC,,Y,Y,H,Residual dipolar couplings,Details regarding the experiments used to collect residual dipolar coupling data are reported below. This includes the spectrometer frequency$ and the isotropic and anisotropic sample and sample conditions.,N,MC,,Y,Y,H,Residual dipolar couplings,Details regarding the experiments used to collect residual dipolar coupling data are reported below. This includes the spectrometer frequency$ and the isotropic and anisotropic sample and sample conditions.5,NMR_parameters,274,dipolar_couplings,dipolar_couplings,N,MC,,Y,Y,,Dipolar_coupling,O,O,O,O,O,O,H,H,H,H,H,H,?,,Dipolar couplings,Please enter the information requested below regarding the experimental details for the deposited dipolar coupling data.,N,MC,,Y,Y,H,Dipolar couplings,Please enter the information requested below regarding the experimental details for the deposited dipolar coupling data.,N,MC,,Y,Y,H,Dipolar couplings,Please enter the information requested below regarding the experimental details for the deposited dipolar coupling data.5,NMR_parameters,280,spectral_density_values,spectral_density_values,N,MC,,Y,Y,,Spectral_density,O,O,O,O,O,O,H,H,H,H,H,H,?,,Spectral density values,Enter a label for each set of reported spectral density values$ the name of the file containing the data$ links to the sample(s) and sample conditions used to collect the data$ and other experimental details.,N,MC,,Y,Y,H,Spectral density values,Enter a label for each set of reported spectral density values$ the name of the file containing the data$ links to the sample(s) and sample conditions used to collect the data$ and other experimental details.,N,MC,,Y,Y,H,Spectral density values,Enter a label for each set of reported spectral density values$ the name of the file containing the data$ links to the sample(s) and sample conditions used to collect the data$ and other experimental details.5,NMR_parameters,320,other_data_types,other_data_types,N,MC,,Y,Y,,Other_data,O,O,O,O,O,O,H,H,H,H,H,H,?,,Other types of Data,If data are being deposited that do not fit any of the categories listed in the entry interview$ details about the data$ a brief description of the kind of information collected$ the samples and NMR experiments used are entered in this section.,N,MC,,Y,Y,H,Other types of Data,If data are being deposited that do not fit any of the categories listed in the entry interview$ details about the data$ a brief description of the kind of information collected$ the samples and NMR experiments used are entered in this section.,N,MC,,Y,Y,H,Other types of Data,If data are being deposited that do not fit any of the categories listed in the entry interview$ details about the data$ a brief description of the kind of information collected$ the samples and NMR experiments used are entered in this section.6,kinetics,325,chemical_rates,chemical_rates,N,MC,,Y,Y,,Chemical_rate,O,O,O,O,O,O,H,H,H,H,H,H,?,,General chemical rate data,Please enter the name of the uploaded file containng the rate values and links to the samples and sample conditions used to collect the data.,N,MC,,Y,Y,H,General chemical rate data,Please enter the name of the uploaded file containng the rate values and links to the samples and sample conditions used to collect the data.,N,MC,,Y,Y,H,General chemical rate data,Please enter the name of the uploaded file containng the rate values and links to the samples and sample conditions used to collect the data.6,kinetics,330,H_exch_rates,H_exch_rates,N,MC,,Y,Y,,H_exch_rate,O,O,O,O,O,O,H,H,H,H,H,H,?,,H-exchange rates,Please enter the name of the uploaded file containng the hydrogen exchange rate values and links to the samples and sample conditions used to collect the data.,N,MC,,Y,Y,H,H-exchange rates,Please enter the name of the uploaded file containng the hydrogen exchange rate values and links to the samples and sample conditions used to collect the data.,N,MC,,Y,Y,H,H-exchange rates,Please enter the name of the uploaded file containng the hydrogen exchange rate values and links to the samples and sample conditions used to collect the data.6,kinetics,340,H_exch_protection_factors,H_exch_protection_factors,N,MC,,Y,Y,,H_exch_protection_factor,O,O,O,O,O,O,H,H,H,H,H,H,?,,H-exchange protection factors,Please provide the name of the uploaded file containing the hydrogen exchange protection factors and links to the samples and sample conditions used to collect the data.,N,MC,,Y,Y,H,H-exchange protection factors,Please provide the name of the uploaded file containing the hydrogen exchange protection factors and links to the samples and sample conditions used to collect the data.,N,MC,,Y,Y,H,H-exchange protection factors,Please provide the name of the uploaded file containing the hydrogen exchange protection factors and links to the samples and sample conditions used to collect the data.6,kinetics,350,homonucl_NOEs,homonucl_NOEs,N,MC,,Y,Y,,Homonucl_NOE,O,O,O,O,O,O,H,H,H,H,H,H,?,,Homonuclear NOEs,Do not use this section to enter information about NOE restraint data used to calculate three-dimensional structures. For other NOE data$ please enter the information requested including links to samples$ sample conditions$ other experimental details relevant to the reported homonuclear NOE data.. ,N,MC,,Y,Y,H,Homonuclear NOEs,Do not use this section to enter information about NOE restraint data used to calculate three-dimensional structures. For other NOE data$ please enter the information requested including links to samples$ sample conditions$ other experimental details relevant to the reported homonuclear NOE data.. ,N,MC,,Y,Y,H,Homonuclear NOEs,Do not use this section to enter information about NOE restraint data used to calculate three-dimensional structures. For other NOE data$ please enter the information requested including links to samples$ sample conditions$ other experimental details relevant to the reported homonuclear NOE data.. 6,kinetics,360,heteronucl_NOEs,heteronucl_NOEs,N,MC,,Y,Y,,Heteronucl_NOE,O,O,O,O,O,O,H,H,H,H,H,H,?,,Heteronuclear NOEs,Please provide a label for each set of deposited heteronuclear NOE data$ the name of the file containing the data$ links to the samples and sample conditions used$ and other experimental details.,N,MC,,Y,Y,H,Heteronuclear NOEs,Please provide a label for each set of deposited heteronuclear NOE data$ the name of the file containing the data$ links to the samples and sample conditions used$ and other experimental details.,N,MC,,Y,Y,H,Heteronuclear NOEs,Please provide a label for each set of deposited heteronuclear NOE data$ the name of the file containing the data$ links to the samples and sample conditions used$ and other experimental details.6,kinetics,370,theoretical_heteronucl_NOEs,theoretical_heteronucl_NOEs,N,MC,,Y,Y,,Theoretical_heteronucl_NOE,O,O,O,O,O,O,H,H,H,H,H,H,?,,Theoretical heteronuclear NOEs,Please provide a label for each set of deposited theoretical heteronuclear NOE data$ the name of the file containing the data$ links to the samples and sample conditions used$ and other experimental details.,N,MC,,Y,Y,H,Theoretical heteronuclear NOEs,Please provide a label for each set of deposited theoretical heteronuclear NOE data$ the name of the file containing the data$ links to the samples and sample conditions used$ and other experimental details.,N,MC,,Y,Y,H,Theoretical heteronuclear NOEs,Please provide a label for each set of deposited theoretical heteronuclear NOE data$ the name of the file containing the data$ links to the samples and sample conditions used$ and other experimental details.6,kinetics,400,heteronucl_T1_relaxation,heteronucl_T1_relaxation,N,MC,,Y,Y,,T1,O,O,O,O,O,O,H,H,H,H,H,H,?,,Heteronuclear T1 data,Please enter a label for each set of heteronuclear T1 relaxation data deposited$ the name of the file containing the data$ the names of the sections for the sample descriptions and sample conditions$ and information describing the T1 values.,N,MC,,Y,Y,H,Heteronuclear T1 data,Please enter a label for each set of heteronuclear T1 relaxation data deposited$ the name of the file containing the data$ the names of the sections for the sample descriptions and sample conditions$ and information describing the T1 values.,N,MC,,Y,Y,H,Heteronuclear T1 data,Please enter a label for each set of heteronuclear T1 relaxation data deposited$ the name of the file containing the data$ the names of the sections for the sample descriptions and sample conditions$ and information describing the T1 values.6,kinetics,402,theoretical_heteronucl_T1_relaxation,theoretical_heteronucl_T1_relaxation,N,MC,,Y,Y,,Theoretical_T1,O,O,O,O,O,O,H,H,H,H,H,H,?,,Theoretical heteronuclear T1 data,Please enter a label for each set of theoretical heteronuclear T1 relaxation data deposited$ the name of the file containing the data$ the names of the sections for the sample descriptions and sample conditions$ and information describing the T1 values.,N,MC,,Y,Y,H,Theoretical heteronuclear T1 data,Please enter a label for each set of theoretical heteronuclear T1 relaxation data deposited$ the name of the file containing the data$ the names of the sections for the sample descriptions and sample conditions$ and information describing the T1 values.,N,MC,,Y,Y,H,Theoretical heteronuclear T1 data,Please enter a label for each set of theoretical heteronuclear T1 relaxation data deposited$ the name of the file containing the data$ the names of the sections for the sample descriptions and sample conditions$ and information describing the T1 values.6,kinetics,410,heteronucl_T1rho_relaxation,heteronucl_T1rho_relaxation,N,MC,,Y,Y,,T1rho,O,O,O,O,O,O,H,H,H,H,H,H,?,,Heteronuclear T1rho data,Create a form for each set of T1rho data that is being deposited. For each set$ provide the name of the deposited file containing the data set$ links to the samples used$ sample conditions$ and specific details about the parameters used to collect the data.,N,MC,,Y,Y,H,Heteronuclear T1rho data,Create a form for each set of T1rho data that is being deposited. For each set$ provide the name of the deposited file containing the data set$ links to the samples used$ sample conditions$ and specific details about the parameters used to collect the data.,N,MC,,Y,Y,H,Heteronuclear T1rho data,Create a form for each set of T1rho data that is being deposited. For each set$ provide the name of the deposited file containing the data set$ links to the samples used$ sample conditions$ and specific details about the parameters used to collect the data.6,kinetics,420,heteronucl_T2_relaxation,heteronucl_T2_relaxation,N,MC,,Y,Y,,T2,O,O,O,O,O,O,H,H,H,H,H,H,?,,Heteronuclear T2 data,Create a form for each set of T2 data that is being deposited. For each set$ provide the name of the deposited file containing the data set$ links to the samples used$ sample conditions$ and specific details about the parameters used to collect the data.,N,MC,,Y,Y,H,Heteronuclear T2 data,Create a form for each set of T2 data that is being deposited. For each set$ provide the name of the deposited file containing the data set$ links to the samples used$ sample conditions$ and specific details about the parameters used to collect the data.,N,MC,,Y,Y,H,Heteronuclear T2 data,Create a form for each set of T2 data that is being deposited. For each set$ provide the name of the deposited file containing the data set$ links to the samples used$ sample conditions$ and specific details about the parameters used to collect the data.6,kinetics,421,theoretical_heteronucl_T2_relaxation,theoretical_heteronucl_T2_relaxation,N,MC,,Y,Y,,Theoretical_T2,O,O,O,O,O,O,H,H,H,H,H,H,?,,Theoretical heteronuclear T2 data,Please enter a label for each set of theoretical heteronuclear T2 relaxation data deposited$ the name of the file containing the data$ the names of the sections for the sample descriptions and sample conditions$ and information describing the T2 values.,N,MC,,Y,Y,H,Theoretical heteronuclear T2 data,Please enter a label for each set of theoretical heteronuclear T2 relaxation data deposited$ the name of the file containing the data$ the names of the sections for the sample descriptions and sample conditions$ and information describing the T2 values.,N,MC,,Y,Y,H,Theoretical heteronuclear T2 data,Please enter a label for each set of theoretical heteronuclear T2 relaxation data deposited$ the name of the file containing the data$ the names of the sections for the sample descriptions and sample conditions$ and information describing the T2 values.6,kinetics,422,auto_relaxation,auto_relaxation,N,MC,,Y,Y,,Auto_relaxation,O,O,O,O,O,O,H,H,H,H,H,H,?,,Auto relaxation data,Create a form for each set of relaxation data that is being deposited. For each set$ provide the name of the deposited file containing the data set$ links to the samples used$ sample conditions$ and specific details about the parameters used to collect the data.,N,MC,,Y,Y,H,Auto relaxation data,Create a form for each set of relaxation data that is being deposited. For each set$ provide the name of the deposited file containing the data set$ links to the samples used$ sample conditions$ and specific details about the parameters used to collect the data.,N,MC,,Y,Y,H,Auto relaxation data,Create a form for each set of relaxation data that is being deposited. For each set$ provide the name of the deposited file containing the data set$ links to the samples used$ sample conditions$ and specific details about the parameters used to collect the data.6,kinetics,424,theoretical_auto_relaxation,theoretical_auto_relaxation,N,MC,,Y,Y,,Theoretical_auto_relaxation,O,O,O,O,O,O,H,H,H,H,H,H,?,,Theoretical auto relaxation,Create a form for each set of theoretical relaxation data that is being deposited. For each set$ provide the name of the deposited file containing the data set$ links to the samples used$ sample conditions$ and specific details about the parameters used to collect the data.,N,MC,,Y,Y,H,Theoretical auto relaxation,Create a form for each set of theoretical relaxation data that is being deposited. For each set$ provide the name of the deposited file containing the data set$ links to the samples used$ sample conditions$ and specific details about the parameters used to collect the data.,N,MC,,Y,Y,H,Theoretical auto relaxation,Create a form for each set of theoretical relaxation data that is being deposited. For each set$ provide the name of the deposited file containing the data set$ links to the samples used$ sample conditions$ and specific details about the parameters used to collect the data.6,kinetics,430,dipole_dipole_relaxation,dipole_dipole_relaxation,N,MC,,Y,Y,,Dipole_dipole_relax,O,O,O,O,O,O,H,H,H,H,H,H,?,,Dipole-Dipole relaxation data,For each set of dipole-dipole relaxation data$ create a new form and supply the labels for the samples used$ sample conditions$ and other experimental details.,N,MC,,Y,Y,H,Dipole-Dipole relaxation data,For each set of dipole-dipole relaxation data$ create a new form and supply the labels for the samples used$ sample conditions$ and other experimental details.,N,MC,,Y,Y,H,Dipole-Dipole relaxation data,For each set of dipole-dipole relaxation data$ create a new form and supply the labels for the samples used$ sample conditions$ and other experimental details.6,kinetics,440,dipole_dipole_cross_correlations,dipole_dipole_cross_correlations,N,MC,,Y,Y,,Cross_correlation_DD,O,O,O,O,O,O,H,H,H,H,H,H,?,,Dipole-Dipole cross correlation relaxation,For each set of dipole-dipole cross correlation relaxation data$ create a new form and supply the labels for the samples used$ sample conditions$ and other experimental details.,N,MC,,Y,Y,H,Dipole-Dipole cross correlation relaxation,For each set of dipole-dipole cross correlation relaxation data$ create a new form and supply the labels for the samples used$ sample conditions$ and other experimental details.,N,MC,,Y,Y,H,Dipole-Dipole cross correlation relaxation,For each set of dipole-dipole cross correlation relaxation data$ create a new form and supply the labels for the samples used$ sample conditions$ and other experimental details.6,kinetics,442,theoretical_dipole_dipole_cross_correlations,theoretical_dipole_dipole_cross_correlations,N,MC,,Y,Y,,Theoretical_cross_correlation_DD,O,O,O,O,O,O,H,H,H,H,H,H,?,,Theoretical dipole-dipole cross correlation relaxation,For each set of theoretical dipole-dipole cross correlation relaxation data$ create a new form and supply the labels for the samples used$ sample conditions$ and other experimental details.,N,MC,,Y,Y,H,Theoretical dipole-dipole cross correlation relaxation,For each set of theoretical dipole-dipole cross correlation relaxation data$ create a new form and supply the labels for the samples used$ sample conditions$ and other experimental details.,N,MC,,Y,Y,H,Theoretical dipole-dipole cross correlation relaxation,For each set of theoretical dipole-dipole cross correlation relaxation data$ create a new form and supply the labels for the samples used$ sample conditions$ and other experimental details.