Dictionary sequence,SFCategory,ADIT super category ID,ADIT super category,ADIT category group ID,ADIT category view name,Tag,Item enumerated,Item enumeration closed,Data Type,Nullable,Row Index Key,Source Key,Table Primary Key,Foreign Table,Foreign Column,Loopflag,Seq,Example,SfNamelFlg,Sf category flag,Sf pointer,default value,Tag category,Tag field,BMRB data type,Dictionary description,?
,,,,,,,Y or N,Y N mY or mN,,,,,,,,,,,?,,,?,,?,?,dictionary,?
1,2,3,4,5,6,7,8,9,10,11,12,13,14,15,16,17,18,19,20,21,22,23,24,25,26,27,28
TBL_BEGIN,,1.0.0.2,,,,,,,,,,,,,,,,,?,,,,,,,?,?
,entry_information,1,entry_information,20,Entry information,_Entry.Sf_category,N,,VARCHAR(127),NOT NULL,N,,,,,N,10,entry_information,N,Y,N,?,Entry,Sf_category,code,A category designation assigned to the save frame on the basis of the information content.,?
,entry_information,1,entry_information,20,Entry information,_Entry.Sf_framecode,N,,VARCHAR(127),NOT NULL,N,,,,,N,,entry_information,Y,N,N,?,Entry,Sf_framecode,framecode,STAR framecode for this save frame.  The value is defined as 'entry_information' for the entry information save frame in each entry.,?
,entry_information,1,entry_information,20,Entry information,_Entry.ID,N,,CHAR(14),NOT NULL,N,Y,Y,,,N,,BMOD00000131,N,N,N,?,Entry,ID,code,BMOD accession number for this entry,?
,entry_information,1,entry_information,20,Entry information,_Entry.Title,N,,TEXT,NOT NULL,N,,,,,N,,FAD,N,N,N,?,Entry,Title,text,A descriptive title for the entry.  Something similar to the title of a scientific paper.,?
,entry_information,1,entry_information,20,Entry information,_Entry.Type,Y,Y,VARCHAR(127),NOT NULL,N,,,,,N,,?,N,N,N,metabolite,Entry,Type,line,The type of BMOD entry.,?
,entry_information,1,entry_information,20,Entry information,_Entry.Version_type,Y,Y,VARCHAR(31),NOT NULL,N,,,,,N,,original,N,N,N,original,Entry,Version_type,line,Defines whether the current version of the entry is the original version or an updated version.,?
,entry_information,1,entry_information,20,Entry information,_Entry.Submission_date,N,,DATETIME year to day,NOT NULL,N,,,,,N,,2018-12-15',N,N,N,?,Entry,Submission_date,yyyy-mm-dd,Date the entry was submitted to BMOD.,?
,entry_information,1,entry_information,20,Entry information,_Entry.Accession_date,N,,DATETIME year to day,NOT NULL,N,,,,,N,,2018-12-15',N,N,N,?,Entry,Accession_date,yyyy-mm-dd,Date BMOD accession number was assigned to the entry.,?
,entry_information,1,entry_information,20,Entry information,_Entry.Last_release_date,N,,DATETIME year to day,,N,,,,,N,,2018-12-15',N,N,N,?,Entry,Last_release_date,yyyy-mm-dd,Date the current version of the entry was released.,?
,entry_information,1,entry_information,20,Entry information,_Entry.Original_release_date,N,,DATETIME year to day,,N,,,,,N,,2018-12-15',N,N,N,?,Entry,Original_release_date,yyyy-mm-dd,Date the entry was originally released.,?
,entry_information,1,entry_information,20,Entry information,_Entry.Origination,N,,VARCHAR(31),NOT NULL,N,,,,,N,,author,N,N,N,author,Entry,Origination,line,The value to this tag defines who entered the original data into the database.  Entries taken from the literature and entered by BMOD staff are marked 'BMOD.'  Entries supplied by authors are marked 'author' and entries taken from the PDB are marked 'PDB.',?
,entry_information,1,entry_information,20,Entry information,_Entry.BMOD_STAR_version,Y,N,VARCHAR(31),NOT NULL,N,,,,,N,,1.0.0.2,N,N,N,1.0.0.0,Entry,BMOD_STAR_version,line,Version of BMOD-STAR in which the current entry is formatted.,?
,entry_information,1,entry_information,20,Entry information,_Entry.DOI,N,,VARCHAR(255),,N,,,,,N,,?,N,N,N,?,Entry,DOI,line,The digital object identifier assigned to this document.,?
,entry_information,1,entry_information,20,Entry information,_Entry.UUID,N,,VARCHAR(255),,N,,,,,N,,?,N,N,N,?,Entry,UUID,line,The universal identifier for this data set.,?
,entry_information,1,entry_information,20,Entry information,_Entry.Details,N,,TEXT,,N,,,,,N,,?,N,N,N,?,Entry,Details,text,An optional text description of the entry used to provide additional information above that given as values to other items in the entry.,?
,entry_information,1,entry_information,20,Entry experimental methods,_Entry_experimental_methods.ID,N,,INTEGER,NOT NULL,N,,Y,,,Y,10,?,N,N,N,?,Entry_experimental_methods,ID,int,A unique identifier for each experimental method used to collect data for the entry.,?
,entry_information,1,entry_information,20,Entry experimental methods,_Entry_experimental_methods.Type,Y,N,VARCHAR(127),NOT NULL,N,,,,,Y,,?,N,N,N,?,Entry_experimental_methods,Type,line,The name of the experimental method used.,?
,entry_information,1,entry_information,20,Entry experimental methods,_Entry_experimental_methods.Subtype,Y,N,VARCHAR(127),,N,,,,,Y,,?,N,N,N,?,Entry_experimental_methods,Subtype,line,The name of the experimental submethod used$ if appropriate.,?
,entry_information,1,entry_information,20,Entry experimental methods,_Entry_experimental_methods.Info_src_ID,N,,INTEGER,,N,,,Info_src,ID,Y,,?,N,N,N,?,Entry_experimental_methods,Info_src_ID,int,Pointer to '_Info_src.ID',?
,entry_information,1,entry_information,20,Entry experimental methods,_Entry_experimental_methods.Entry_ID,N,,CHAR(14),NOT NULL,N,,Y,Entry,ID,Y,,?,N,N,N,?,Entry_experimental_methods,Entry_ID,code,Pointer to '_Entry.ID',?
,entry_information,1,entry_information,20,Entry source organization,_Entry_src.ID,N,,INTEGER,NOT NULL,Y,,Y,,,Y,,1,N,N,N,?,Entry_src,ID,int,A unique integer identifier for the organization or project that was the source of the entry.,?
,entry_information,1,entry_information,20,Entry source organization,_Entry_src.Project_name,N,,VARCHAR(127),,N,,,,,Y,,NIH Protein Structure Initiative,N,N,N,?,Entry_src,Project_name,line,Name of the project under which the data reported in an entry was sponsored or funded. This might be the title for a grant funding the research or the name of the overall project defined by a granting agency.,?
,entry_information,1,entry_information,20,Entry source organization,_Entry_src.Organization_full_name,Y,N,VARCHAR(127),,N,,,,,Y,,Wuthrich group; ETH,N,N,N,?,Entry_src,Organization_full_name,line,Name of the organization (company$ research laboratory$ etc.) that carried out the research reported in the entry.,?
,entry_information,1,entry_information,20,Entry source organization,_Entry_src.Organization_initials,N,,VARCHAR(127),,N,,,,,Y,,NESGC,N,N,N,?,Entry_src,Organization_initials,line,Laboratory title or name or acronym for the organization where the research was conducted.  More than one organization can be provided.,?
,entry_information,1,entry_information,20,Entry source organization,_Entry_src.Entry_ID,N,,CHAR(14),NOT NULL,N,,Y,Entry,ID,Y,,?,N,N,N,?,Entry_src,Entry_ID,code,Pointer to '_Entry.ID',?
,entry_information,1,entry_information,20,Information source,_Info_src.ID,N,,INTEGER,NOT NULL,Y,Y,Y,,,Y,,?,N,N,N,?,Info_src,ID,int,A unique identifier assigned to the information source described.,?
,entry_information,1,entry_information,20,Information source,_Info_src.Project_name,N,,VARCHAR(127),NOT NULL,N,,,,,Y,,?,N,N,N,?,Info_src,Project_name,line,The name of the project that was the source of information included in the entry.,?
,entry_information,1,entry_information,20,Information source,_Info_src.Organization_full_name,Y,N,VARCHAR(127),,N,,,,,Y,,?,N,N,N,?,Info_src,Organization_full_name,line,The name of the organization that was the source of information included in the entry.,?
,entry_information,1,entry_information,20,Information source,_Info_src.Organization_initials,Y,N,VARCHAR(127),,N,,,,,Y,,?,N,N,N,?,Info_src,Organization_initials,line,The initials or acronym for the organization that was the source of information included in the entry.,?
,entry_information,1,entry_information,20,Information source,_Info_src.Entry_code,N,,VARCHAR(127),NOT NULL,N,,,,,Y,,?,N,N,N,?,Info_src,Entry_code,line,The code for the entry from which information was taken for inclusion in the entry.,?
,entry_information,1,entry_information,20,Information source,_Info_src.Internal_name,Y,N,VARCHAR(127),,N,,,,,Y,,?,N,N,N,?,Info_src,Internal_name,line,An internal code assigned to the organization$ project$ and entry from which information was taken for inclusion in this entry.,?
,entry_information,1,entry_information,20,Information source,_Info_src.Download_date,N,,DATETIME year to day,NOT NULL,N,,,,,Y,,?,N,N,N,?,Info_src,Download_date,yyyy-mm-dd,Date that the data was extracted from the defined source.,?
,entry_information,1,entry_information,20,Information source,_Info_src.Details,N,,TEXT,,N,,,,,Y,,?,N,N,N,?,Info_src,Details,text,Additional details about the information source.,?
,entry_information,1,entry_information,20,Information source,_Info_src.Entry_ID,N,,CHAR(14),NOT NULL,N,,Y,,,Y,,?,N,N,N,?,Info_src,Entry_ID,code,Pointer to '_Entry.ID',?
,entry_information,1,entry_information,20,Data set,_Data_set.Type,Y,Y,VARCHAR(127),NOT NULL,N,,Y,,,Y,,assigned_chemical_shifts,N,N,N,?,Data_set,Type,line,The save frame category type that contain quantitative data of the kind that is summarized in this table.  The enumerated list for this tag is a subset of the full list of save frame categories available in constructing a BMOD NMR-STAR file.,?
,entry_information,1,entry_information,20,Data set,_Data_set.Count,N,,INTEGER,NOT NULL,N,,,,,Y,,2,N,N,N,?,Data_set,Count,int,The integer number of save frames in the entry that are of the type given by the value to the tag '_Saveframe_category_type' in this loop.,?
,entry_information,1,entry_information,20,Data set,_Data_set.Entry_ID,N,,CHAR(14),NOT NULL,N,,Y,Entry,ID,Y,,?,N,N,N,?,Data_set,Entry_ID,code,Pointer to '_Entry.ID',?
,entry_information,1,entry_information,20,Datum,_Datum.Type,Y,Y,VARCHAR(127),NOT NULL,N,,Y,,,Y,,1H chemical shifts,N,N,N,?,Datum,Type,line,A type of quantitative data found in the entry.,?
,entry_information,1,entry_information,20,Datum,_Datum.Count,N,,INTEGER,NOT NULL,N,,,,,Y,,981,N,N,N,?,Datum,Count,int,An integer representing the total number of values of the type defined by the value to the tag '_Data_type' found in all save frames in the current entry.,?
,entry_information,1,entry_information,20,Datum,_Datum.Entry_ID,N,,CHAR(14),NOT NULL,N,,Y,Entry,ID,Y,,?,N,N,N,?,Datum,Entry_ID,code,Pointer to '_Entry.ID',?
,entry_information,1,entry_information,20,Entry authors (include contact names in this list$ if appropriate),_Entry_author.Ordinal,N,,INTEGER,NOT NULL,Y,,Y,,,Y,,1,N,N,N,?,Entry_author,Ordinal,int,Integer value defining the position of the author's name in the list of authors.,?
,entry_information,1,entry_information,20,Entry authors (include contact names in this list$ if appropriate),_Entry_author.Given_name,N,,VARCHAR(31),,N,,,,,Y,,Adlai,N,N,N,?,Entry_author,Given_name,line,The name given the author at birth or currently used by the author for publication purposes.  Can be an initial if the author uses a second name as a full name when publishing.,?
,entry_information,1,entry_information,20,Entry authors (include contact names in this list$ if appropriate),_Entry_author.Family_name,N,,VARCHAR(127),NOT NULL,N,,,,,Y,,Stevenson,N,N,N,?,Entry_author,Family_name,line,The family name of the author.,?
,entry_information,1,entry_information,20,Entry authors (include contact names in this list$ if appropriate),_Entry_author.First_initial,N,,VARCHAR(15),,N,,,,,Y,,A.,N,N,N,?,Entry_author,First_initial,code,Initial of the author's first name.,?
,entry_information,1,entry_information,20,Entry authors (include contact names in this list$ if appropriate),_Entry_author.Middle_initials,N,,VARCHAR(15),,N,,,,,Y,,T.L.,N,N,N,?,Entry_author,Middle_initials,code,The initials for the author's middle names.  A name can be used here if the author uses a full middle name for publications.,?
,entry_information,1,entry_information,20,Entry authors (include contact names in this list$ if appropriate),_Entry_author.Family_title,Y,N,VARCHAR(15),,N,,,,,Y,,Jr.,N,N,N,?,Entry_author,Family_title,code,A common family title (not a professional title).,?
,entry_information,1,entry_information,20,Entry authors (include contact names in this list$ if appropriate),_Entry_author.ORCID,N,,VARCHAR(127),,N,,,,,Y,,?,N,N,N,?,Entry_author,ORCID,line,A unique identifier for individuals involved in scientific research and publication.,?
,entry_information,1,entry_information,20,Entry authors (include contact names in this list$ if appropriate),_Entry_author.Entry_ID,N,,CHAR(14),NOT NULL,N,,Y,Entry,ID,Y,,?,N,N,N,?,Entry_author,Entry_ID,code,Pointer to '_Entry.ID',?
,entry_information,1,entry_information,20,Auxiliary files,_Auxiliary_files.ID,N,N,INTEGER,NOT NULL,N,,Y,,,Y,,?,N,N,N,?,Auxiliary_files,ID,int,The '_Auxiliary_files.ID' value uniquely identifies the row of information describing an auxilary file related to the entry.,?
,entry_information,1,entry_information,20,Auxiliary files,_Auxiliary_files.Name,N,N,VARCHAR(127),,N,,,,,Y,,?,N,N,N,?,Auxiliary_files,Name,line,Name of the auxiliary file.,?
,entry_information,1,entry_information,20,Auxiliary files,_Auxiliary_files.Format,N,N,VARCHAR(127),NOT NULL,N,,,,,Y,,?,N,N,N,?,Auxiliary_files,Format,line,The file format for the defined auxiliary file.,?
,entry_information,1,entry_information,20,Auxiliary files,_Auxiliary_files.URI,N,N,VARCHAR(255),,N,,,,,Y,,?,N,N,N,?,Auxiliary_files,URI,line,A universal resource identifier for the auxiliary file.,?
,entry_information,1,entry_information,20,Auxiliary files,_Auxiliary_files.DOI,N,N,VARCHAR(255),,N,,,,,Y,,?,N,N,N,?,Auxiliary_files,DOI,line,A digital object identifier for the defined auxiliary file.,?
,entry_information,1,entry_information,20,Auxiliary files,_Auxiliary_files.Path,N,N,VARCHAR(255),NOT NULL,N,,,,,Y,,?,N,N,N,?,Auxiliary_files,Path,line,The path and file name for the auxiliary file.,?
,entry_information,1,entry_information,20,Auxiliary files,_Auxiliary_files.Details,N,N,TEXT,,N,,,,,Y,,?,N,N,N,?,Auxiliary_files,Details,text,Text providing additional information about the auxiliary file.,?
,entry_information,1,entry_information,20,Auxiliary files,_Auxiliary_files.Entry_ID,N,N,CHAR(14),NOT NULL,N,,Y,Entry,ID,Y,,_Entry.ID,N,N,N,?,Auxiliary_files,Entry_ID,code,Pointer to '_Entry.ID',?
,entry_information,1,entry_information,20,Release,_Release.Release_number,N,,INTEGER,NOT NULL,N,,Y,,,Y,,1,N,N,N,?,Release,Release_number,int,Unique code assigned to each release of an entry,?
,entry_information,1,entry_information,20,Release,_Release.Date,N,,DATETIME year to day,NOT NULL,N,,,,,Y,,2018-12-15',N,N,N,?,Release,Date,yyyy-mm-dd,Date entry was released.,?
,entry_information,1,entry_information,20,Release,_Release.Submission_date,N,,DATETIME year to day,,N,,,,,Y,,2018-12-15',N,N,N,?,Release,Submission_date,yyyy-mm-dd,Date the entry or an update to the entry was submitted to BMOD.,?
,entry_information,1,entry_information,20,Release,_Release.Type,Y,N,VARCHAR(31),NOT NULL,N,,,,,Y,,original,N,N,N,?,Release,Type,line,Value describing with a key word the type of entry that was released.,?
,entry_information,1,entry_information,20,Release,_Release.Author,N,,VARCHAR(31),NOT NULL,N,,,,,Y,,author,N,N,N,?,Release,Author,line,A keyword indicating the type of author of the release.,?
,entry_information,1,entry_information,20,Release,_Release.Detail,N,,TEXT,,N,,,,,Y,,Oringinal entry release,N,N,N,?,Release,Detail,text,Text describing the changes made to the entry.,?
,entry_information,1,entry_information,20,Release,_Release.Entry_ID,N,,CHAR(14),NOT NULL,N,,Y,Entry,ID,Y,,?,N,N,N,?,Release,Entry_ID,code,Pointer to '_Entry.ID',?
,citations,2,citations,40,Citation,_Citation.Sf_category,N,,VARCHAR(127),NOT NULL,N,,,,,N,,?,N,Y,N,?,Citation,Sf_category,code,A category designation assigned to the save frame on the basis of the information content.,?
,citations,2,citations,40,Citation,_Citation.Sf_framecode,N,,VARCHAR(127),NOT NULL,N,,,,,N,,citation 1,Y,N,N,entry_citation,Citation,Sf_framecode,framecode,A label that uniquely identifies the citation from other citations in the entry.,?
,citations,2,citations,40,Citation,_Citation.Entry_ID,N,,CHAR(14),NOT NULL,N,,Y,Entry,ID,N,,citation,N,N,N,?,Citation,Entry_ID,code,Pointer to '_Entry.ID',?
,citations,2,citations,40,Citation,_Citation.ID,N,,INTEGER,NOT NULL,N,Y,Y,,,N,,?,N,N,N,?,Citation,ID,int,A value that uniquely identifies the citation from all other citations provided in the entry.,?
,citations,2,citations,40,Citation,_Citation.Class,Y,Y,VARCHAR(31),NOT NULL,N,,,,,N,,entry citation,N,N,N,entry citation,Citation,Class,line,Keyword defining the citation as the key citation for the entry or a citation used as a referenece in the entry.,?
,citations,2,citations,40,Citation,_Citation.CAS_abstract_code,N,,VARCHAR(31),,N,,,,,N,,?,N,N,N,?,Citation,CAS_abstract_code,code,Code from the Chemical Abstract Services assigned to this citation.,?
,citations,2,citations,40,Citation,_Citation.MEDLINE_UI_code,N,,VARCHAR(31),,N,,,,,N,,?,N,N,N,?,Citation,MEDLINE_UI_code,code,MEDLINE uniform identification code assigned to the publication described in the save frame.,?
,citations,2,citations,40,Citation,_Citation.DOI,N,,VARCHAR(127),,N,,,,,N,,10.1000/182,N,N,N,?,Citation,DOI,line,The digital object identifier assigned to the citation.,?
,citations,2,citations,40,Citation,_Citation.PubMed_ID,N,,CHAR(12),,N,,,,,N,,12815265,N,N,N,?,Citation,PubMed_ID,code,The identification code assigned to the publication by PubMed.,?
,citations,2,citations,40,Citation,_Citation.Full_citation,N,,TEXT,,N,,,,,N,,?,N,N,N,?,Citation,Full_citation,text,Full publication citation including authors title journal page numbers year or equivalent information for the type of publication given.,?
,citations,2,citations,40,Citation,_Citation.Title,N,,TEXT,,N,,,,,N,,'1H and 15N Assigned Chemical Shifts for RNase A',N,N,N,?,Citation,Title,text,Title for the publication.,?
,citations,2,citations,40,Citation,_Citation.Status,Y,Y,VARCHAR(31),,N,,,,,N,,submitted,N,N,N,in preparation,Citation,Status,line,Status for the current publication (in preparation; submitted; in press; published),?
,citations,2,citations,40,Citation,_Citation.Type,Y,Y,VARCHAR(31),,N,,,,,N,,journal,N,N,N,journal,Citation,Type,line,Descriptive word that defines the kind of publication reported (journal; book; thesis; etc.),?
,citations,2,citations,40,Citation,_Citation.Journal_abbrev,Y,N,VARCHAR(127),,N,,,,,N,,J. Biomol. NMR,N,N,N,?,Citation,Journal_abbrev,line,Standard abbreviation for journals used by the Chemical Abstract Services.,?
,citations,2,citations,40,Citation,_Citation.Journal_name_full,N,,VARCHAR(127),,N,,,,,N,,Journal of Biomolecular NMR,N,N,N,?,Citation,Journal_name_full,line,Full name used by the journal.,?
,citations,2,citations,40,Citation,_Citation.Journal_volume,N,,VARCHAR(15),,N,,,,,N,,23,N,N,N,?,Citation,Journal_volume,code,Volume designation used by the journal.,?
,citations,2,citations,40,Citation,_Citation.Journal_issue,N,,VARCHAR(15),,N,,,,,N,,4,N,N,N,?,Citation,Journal_issue,line,Issue designation used by the journal.,?
,citations,2,citations,40,Citation,_Citation.Journal_ASTM,N,,VARCHAR(127),,N,,,,,N,,?,N,N,N,?,Citation,Journal_ASTM,line,ASTM identification code for the journal.,?
,citations,2,citations,40,Citation,_Citation.Journal_ISSN,N,,VARCHAR(127),,N,,,,,N,,?,N,N,N,?,Citation,Journal_ISSN,line,An International Standard Serial Number (ISSN) is a unique eight-digit number used to identify a print or electronic periodical publication.,?
,citations,2,citations,40,Citation,_Citation.Journal_CSD,N,,VARCHAR(127),,N,,,,,N,,?,N,N,N,?,Citation,Journal_CSD,line,CSD identification code for the journal.,?
,citations,2,citations,40,Citation,_Citation.WWW_URL,N,,TEXT,,N,,,,,N,,?,N,N,N,?,Citation,WWW_URL,text,A World Wide Web universal locator that identifies the location of the cited material on the WWW.,?
,citations,2,citations,40,Citation,_Citation.Page_first,N,,VARCHAR(15),,N,,,,,N,,123,N,N,N,?,Citation,Page_first,code,First page of the published article.,?
,citations,2,citations,40,Citation,_Citation.Page_last,N,,VARCHAR(15),,N,,,,,N,,145,N,N,N,?,Citation,Page_last,code,Last page of the published article.,?
,citations,2,citations,40,Citation,_Citation.Year,N,,VARCHAR(15),,N,,,,,N,,2003,N,N,N,?,Citation,Year,code,Calendar year when the article was published.,?
,citations,2,citations,40,Citation,_Citation.Details,N,,TEXT,,N,,,,,N,,The first and second authors contributed equally to this publication.,N,N,N,?,Citation,Details,text,Additional information relevant to the data in the current save frame or to a specific data item is entered as a value to this tag.  The information entered must supplement information already present.  Whenever possible data should associated with specific data tags and not included in the value to a '_Details' tag.,?
,citations,2,citations,40,Citation author,_Citation_author.Ordinal,N,,INTEGER,NOT NULL,Y,,Y,,,Y,,1,N,N,N,?,Citation_author,Ordinal,int,Integer value defining the position of the author's name in the list of authors.,?
,citations,2,citations,40,Citation author,_Citation_author.Given_name,N,,VARCHAR(31),,N,,,,,Y,,John,N,N,N,?,Citation_author,Given_name,line,The name given the author at birth or currently used by the author for publication purposes.  Can be an initial if the author uses a second name as a full name when publishing.,?
,citations,2,citations,40,Citation author,_Citation_author.Family_name,N,,VARCHAR(31),NOT NULL,N,,,,,Y,,Doe,N,N,N,?,Citation_author,Family_name,line,The family name of the author.,?
,citations,2,citations,40,Citation author,_Citation_author.First_initial,N,,VARCHAR(15),,N,,,,,Y,,J.,N,N,N,?,Citation_author,First_initial,code,Initial of the author's first name.,?
,citations,2,citations,40,Citation author,_Citation_author.Middle_initials,N,,VARCHAR(15),,N,,,,,Y,,L.R.,N,N,N,?,Citation_author,Middle_initials,code,The initials for the author's middle names.  A name can be used here$ if the author uses a full middle name for publications.,?
,citations,2,citations,40,Citation author,_Citation_author.Family_title,Y,N,VARCHAR(15),,N,,,,,Y,,Jr.,N,N,N,?,Citation_author,Family_title,code,A common family title (not a professional title).,?
,citations,2,citations,40,Citation author,_Citation_author.ORCID,N,,VARCHAR(127),,N,,,,,Y,,?,N,N,N,?,Citation_author,ORCID,line,Unique personal identifier for researchers (Open Researcher and Contributor ID) used to link a researcher to their publications and grants.,?
,citations,2,citations,40,Citation author,_Citation_author.Entry_ID,N,,CHAR(14),NOT NULL,N,,Y,Citation,Entry_ID,Y,,?,N,N,N,?,Citation_author,Entry_ID,code,Pointer to '_Entry.ID',?
,citations,2,citations,40,Citation author,_Citation_author.Citation_ID,N,,INTEGER,NOT NULL,N,,Y,Citation,ID,Y,,?,N,N,N,?,Citation_author,Citation_ID,int,Pointer to '_Citation.ID',?
,references,2,citations,42,Reference list,_Reference_list.Sf_category,N,,VARCHAR(127),,N,,,,,N,,?,N,Y,N,?,Reference_list,Sf_category,line,A category designation assigned to the save frame on the basis of the information content.,?
,references,2,citations,42,Reference list,_Reference_list.Sf_framecode,N,,VARCHAR(127),,N,,,,,N,,?,Y,N,N,?,Reference_list,Sf_framecode,line,A descriptive label for the save frame.,?
,references,2,citations,42,Reference list,_Reference_list.Entry_ID,N,,CHAR(14),,N,,,Entry,ID,N,,?,N,N,N,?,Reference_list,Entry_ID,code,Pointer to '_Entry.ID',?
,references,2,citations,42,Reference list,_Reference_list.ID,N,,INTEGER,,N,Y,,,,N,,?,N,N,N,?,Reference_list,ID,int,A code that uniquely identifies the save frame from other save frames of this category.,?
,references,2,citations,42,Reference,_Reference.ID,N,,INTEGER,,N,Y,,,,Y,,?,N,N,N,?,Reference,ID,int,A unique identifier for the reference.,?
,references,2,citations,42,Reference,_Reference.Class,Y,Y,VARCHAR(127),,N,,,,,Y,,?,N,N,N,?,Reference,Class,line,The class assigned to the reference.,?
,references,2,citations,42,Reference,_Reference.Info_src_ID,N,,INTEGER,,N,,,Info_src,ID,Y,,?,N,N,N,?,Reference,Info_src_ID,int,Pointer to '_Info_src.ID',?
,references,2,citations,42,Reference,_Reference.Full_reference,N,,TEXT,,N,,,,,Y,,?,N,N,N,?,Reference,Full_reference,text,Full publication citation including authors title journal page numbers year or equivalent information for the type of publication given.,?
,references,2,citations,42,Reference,_Reference.Authors,N,,TEXT,,N,,,,,Y,,?,N,N,N,?,Reference,Authors,text,Text listing the authors of the cited reference.,?
,references,2,citations,42,Reference,_Reference.Title,N,,TEXT,,N,,,,,Y,,?,N,N,N,?,Reference,Title,text,Title for the publication.,?
,references,2,citations,42,Reference,_Reference.Journal_name_full,N,,VARCHAR(127),,N,,,,,Y,,?,N,N,N,?,Reference,Journal_name_full,line,Full name used by the journal.,?
,references,2,citations,42,Reference,_Reference.Year,N,,VARCHAR(15),,N,,,,,Y,,?,N,N,N,?,Reference,Year,line,Calendar year when the article was published.,?
,references,2,citations,42,Reference,_Reference.Journal_volume,N,,VARCHAR(15),,N,,,,,Y,,?,N,N,N,?,Reference,Journal_volume,code,Volume designation used by the journal.,?
,references,2,citations,42,Reference,_Reference.Journal_issue,N,,VARCHAR(15),,N,,,,,Y,,?,N,N,N,?,Reference,Journal_issue,code,Issue designation used by the journal.,?
,references,2,citations,42,Reference,_Reference.DOI,N,,VARCHAR(127),,N,,,,,Y,,?,N,N,N,?,Reference,DOI,line,The digital object identifier assigned to the reference.,?
,references,2,citations,42,Reference,_Reference.WWW_URL,N,,TEXT,,N,,,,,Y,,?,N,N,N,?,Reference,WWW_URL,text,A World Wide Web universal locator that identifies the location of the cited material on the WWW.,?
,references,2,citations,42,Reference,_Reference.PubMed_ID,N,,CHAR(12),,N,,,,,Y,,?,N,N,N,?,Reference,PubMed_ID,code,The identification code assigned to the publication by PubMed.,?
,references,2,citations,42,Reference,_Reference.PubMed_URL,N,,TEXT,,N,,,,,Y,,?,N,N,N,?,Reference,PubMed_URL,text,The PubMed URL for the reference.,?
